{
  "blockers": [],
  "changed_files": [
    "scripts/bears_doctor.py"
  ],
  "checks": [
    {
      "component_issue": "#383",
      "exit_code": 0,
      "id": "decision_ledger_required",
      "required": true,
      "status": "pass",
      "summary": "decision-required paths are covered"
    }
  ],
  "closeout_summary": {
    "affected_range": "HEAD^..HEAD",
    "changelog": {
      "delivery_id": "bears-governance-kernel-v1",
      "reference": "release-note-gate:#384 delivery_id:bears-governance-kernel-v1",
      "status": "linked"
    },
    "cleanup_status": "no_tracked_runtime_files",
    "debt_status": "none",
    "delivery_id": "bears-governance-kernel-v1",
    "doctor_result": "pass",
    "expected_evidence_paths": [
      "runtime/local-commit-validation/0123456789abcdef0123456789abcdef01234567.json",
      "runtime/bears-doctor/0123456789abcdef0123456789abcdef01234567.closeout.json"
    ],
    "final_report_policy": "Final user replies may stay short after bears_doctor emits closeout_summary with delivery_id.",
    "final_sha": "0123456789abcdef0123456789abcdef01234567",
    "issue_refs": [
      "#391"
    ],
    "known_blockers": [],
    "scope": "machine-first-execution-kernel",
    "validation_result": "pass"
  },
  "commit_range": "HEAD~1..HEAD",
  "failed_checks": [],
  "required_next_actions": [],
  "sanitized_summary": "closeout checks passed",
  "schema": "bears-doctor-result.v1",
  "status": "pass",
  "version": "1",
  "warnings": []
}
